<?xml version="1.0" encoding="UTF-8"?>
<estructuraBD nombre="videoclub2" xmlns:xsi="http://www.w3.org/2001/XMLSchema-instance" xsi:noNamespaceSchemaLocation="estructuraBd.xsd">
    <tablas nombre="peliculas">
        <campo nombre="cod" tipo="INT" longitud="5" />        
        <campo nombre="titulo" tipo="VARCHAR" longitud="40" />
        <campo nombre="genero" tipo="ENUM" lista_de_valores="Humor AcciÃ³n Thriller" null="1" />
        <primary_key campos_clave="cod" />
    </tablas>
    <tabla nombre="clientes">
        <campo nombre="cod" tipo="INT" longitud="4" />
        <campo nombre="nombre" tipo="VARCHAR" longitud="20" />
        <campo nombre="ap1" tipo="VARCHAR" longitud="20" />
        <campo nombre="ap2" tipo="VARCHAR" longitud="20" null="1" />
        <primary_key campos_clave="cod" />
    </tabla>
    <tabla nombre="alquileres">
        <campo nombre="clientes_cod" tipo="INT" longitud="4" />
        <campo nombre="peliculas_cod" tipo="INT" longitud="5" />
        <campo nombre="fecha" tipo="DATETIME" />
        <campo nombre="precio" tipo="DECIMAL" longitud="5" />
        <primary_key campos_clave="clientes_cod peliculas_cod fecha" />
        <foreign_key campos_clave="clientes_cod"  tabla_ajena="clientes" campos_relacionados="cod" />
        <foreign_key campos_clave="peliculas_cod" tabla_ajena="peliculas" campos_relacionados="cod" />
    </tabla>
    <tabla nombre="ingresos">
        <campo nombre="clientes_cod" tipo="INT" longitud="4"/>
        <campo nombre="fecha" tipo="DATETIME"/>
        <campo nombre="cantidad" tipo="DECIMAL" longitud="5"/>
        <primary_key campos_clave="clientes_cod fecha"/>
        <foreign_key campos_clave="clientes_cod" tabla_ajena="clientes" campos_relacionados="cod"/>
    </tabla>
    <tabla nombre="reservas">
        <campo nombre="clientes_cod" tipo="INT" longitud="4"/>
        <campo nombre="peliculas_cod" tipo="INT" longitud="5"/>
        <campo nombre="fecha" tipo="DATETIME"/>
        <campo nombre="precio" tipo="DECIMAL" longitud="5"/>
        <primary_key campos_clave="clientes_cod"/>
        <foreign_key campos_clave="clientes_cod" tabla_ajena="clientes" campos_relacionados="cod"/>
        <foreign_key campos_clave="peliculas_cod" tabla_ajena="peliculas" campos_relacionados="cod"/>
    </tabla>
</estructuraBD>

